{
  "session_id": "fixture-session-partial",
  "scenario_id": "semiconductor-fixture",
  "scenario_version": 1,
  "turn_no": 2,
  "answers": [
    {
      "question_id": "RATIONALE-T2",
      "text": "AI 투자 확대 때문에 HBM 수요 증가가 이어질 것으로 봤다. 다만 SK하이닉스의 구체적인 사업 노출은 확인하지 못했다.",
      "selected": ["HOLD"],
      "target_entity_ids": ["000660"],
      "requires_explanation": true
    }
  ],
  "orders": [],
  "portfolio_before": [],
  "portfolio_after": [],
  "visible_claim_ids": ["CLM-FIX-AI-CAPEX", "CLM-FIX-HBM-DEMAND", "CLM-FIX-TARGET-EXPOSURE", "CLM-FIX-EARNINGS"],
  "dependency_diagnostics": []
}
